{
  "schema_version": "1.0",
  "project_id": "crumb",
  "status": "PENDING",
  "spec_revision": 1,
  "design_digest": "5a0a2b2785e43e8dd29a5e3b8d696789153f6d435251b4bea32d18e6f64de733",
  "approved_by": null,
  "approved_at": null,
  "unresolved_policy_items": [],
  "pending_tier_c_items": [
    "TC_BUTTON_WINDOW",
    "TC_STEREO_AUDIO"
  ]
}
